{"build_id":"2026-07-03_post_merge_closeout_acceptance_reference_consistency_contract_v1","lane_id":"POST_MERGE_CLOSEOUT_EVIDENCE_CONSISTENCY_CONTRACT","closeout_packet":{"artifact_id":"post_merge_closeout_evidence_consistency_contract_pr_11_post_merge_closeout_20260703_020715.zip","sha256":"28D92EE2E4405770EBF4CEEF081B9A7C9650C27AB245E98431942CF3E7EAB424","classification":"POST_MERGE_CLOSEOUT_EVIDENCE_CONSISTENCY_CONTRACT_PR_11_POST_MERGE_CLOSEOUT_READY","blocker_matrix":"NO_BLOCKERS"},"owner_acceptance":"OWNER_ACCEPT_PR_11_LANE_CLOSED_MERGED_NO_RUNTIME_ACTION","final_lane_status":"CLOSED_MERGED_NO_RUNTIME_ACTION","pr":{"number":11,"state":"MERGED","merged_at":"2026-07-02T10:10:33Z"},"squash_commit":"8934e5cd1370bb38a2ad062b2b45fa7048e301f2","remote_master":"8934e5cd1370bb38a2ad062b2b45fa7048e301f2","retained_branch":{"name":"post-submission/post-merge-closeout-evidence-consistency-contract","head":"fb6f77fced275a7993a8d6ff66569d78cc0975cf"},"next_scout":{"artifact_id":"authoritative_next_lane_scout_after_pr11_closeout_20260703_022647.zip","sha256":"9DEA33832710B29E01D3F57099E1C7752C6E3331590A5D3AD97F1F3A87E7C6FA","classification":"AUTHORITATIVE_NEXT_LANE_SCOUT_AFTER_PR11_CLOSEOUT_READY","primary_recommendation":"POST_MERGE_CLOSEOUT_ACCEPTANCE_REFERENCE_CONSISTENCY_CONTRACT","source_lane_id":"POST_MERGE_CLOSEOUT_EVIDENCE_CONSISTENCY_CONTRACT","owner_acceptance":"OWNER_ACCEPT_PR_11_LANE_CLOSED_MERGED_NO_RUNTIME_ACTION"},"safety_boundary":{"deploy":false,"runtime":false,"api":false,"auth":false,"billing":false,"trading":false,"private_access":false,"contracts_access":false,"fetch":false,"pull":false,"checkout_switch":false,"push":false,"branch_deletion":false,"pr_mutation":false}}
